URL,Version,Status,OIDs,Name,Title,Description,Used
https://terminology.hlth.gov.bc.ca/ClientRegistry/CodeSystem/bc-client-registry-address-validation-code-system,1.0.0,active,,AddressValidationCS,BC Client Registry Address Validation Status Code,"Codes used to define the address validation status.",
https://terminology.hlth.gov.bc.ca/ClientRegistry/CodeSystem/bc-client-registry-merge-status-code-system,1.0.0,active,,MergeStatusCS,BC Client Registry merge status.,"Codes used to describe the merge status.",
https://terminology.hlth.gov.bc.ca/ClientRegistry/CodeSystem/bc-client-registry-patient-change-notification-events,1.0.0,active,,PatientChangeNotificationEvents,BC Client Registry Patient Change Notification Events Code System,"Codes used to indicate that type of patient changes that a subscriber is interested in receiving.",
https://terminology.hlth.gov.bc.ca/ClientRegistry/CodeSystem/bc-identifier-status-code-system,1.0.0,active,,IdentifierStatusCS,BC Client registry identifier status code system,"BC Client registry identifier status code system.",
https://terminology.hlth.gov.bc.ca/ClientRegistry/CodeSystem/bc-operation-outcome-details-code-system,1.0.0,active,,OperationOutcomeDetailsCS,BC Client Registry Operation Outcome details code system,"BC Client Registry Operation Outcome details code system",
